{
  "$schema": "https://json-schema.org/draft/2020-12/schema",
  "$id": "alexandria/book.schema.json",
  "title": "Alexandria book metadata",
  "type": "object",
  "additionalProperties": false,
  "required": ["schemaVersion", "title", "authors", "translators", "firstPublishedYear", "language", "description", "publicDomain", "bans", "pdf", "submittedVia", "scanReportCid"],
  "properties": {
    "schemaVersion": { "const": "1.0.0" },
    "title": { "type": "string", "minLength": 1, "maxLength": 300 },
    "authors": { "type": "array", "minItems": 1, "items": { "$ref": "#/$defs/person" } },
    "translators": { "type": "array", "items": { "$ref": "#/$defs/person" } },
    "firstPublishedYear": { "type": "integer", "minimum": -3000, "maximum": 2026 },
    "language": { "type": "string", "pattern": "^[a-z]{2,3}(-[A-Za-z0-9]{2,8})*$" },
    "description": { "type": "string", "maxLength": 1000 },
    "publicDomain": {
      "type": "object",
      "additionalProperties": false,
      "required": ["sourceName", "sourceUrl"],
      "properties": {
        "sourceName": { "type": "string", "minLength": 1, "maxLength": 100 },
        "sourceUrl": { "type": "string", "pattern": "^https://", "maxLength": 500 }
      }
    },
    "bans": { "type": "array", "minItems": 1, "items": { "$ref": "#/$defs/ban" } },
    "pdf": {
      "type": "object",
      "additionalProperties": false,
      "required": ["cid", "sha256", "bytes", "pages"],
      "properties": {
        "cid": { "type": "string", "pattern": "^baf[a-z2-7]{20,97}$" },
        "sha256": { "type": "string", "pattern": "^0x[0-9a-f]{64}$" },
        "bytes": { "type": "integer", "minimum": 1, "maximum": 31457280 },
        "pages": { "type": "integer", "minimum": 1 }
      }
    },
    "submittedVia": { "enum": ["web", "ubot", "direct"] },
    "scanReportCid": { "type": ["string", "null"], "pattern": "^baf[a-z2-7]{20,97}$" }
  },
  "$defs": {
    "person": {
      "type": "object",
      "additionalProperties": false,
      "required": ["name", "deathYear"],
      "properties": {
        "name": { "type": "string", "minLength": 1, "maxLength": 200 },
        "deathYear": { "type": ["integer", "null"], "maximum": 2026, "description": "null = unknown or living; sends the book to review" }
      }
    },
    "ban": {
      "type": "object",
      "additionalProperties": false,
      "required": ["country", "authority", "year", "scope", "sourceUrl"],
      "properties": {
        "country": { "type": "string", "pattern": "^[A-Z]{2}$", "description": "ISO 3166-1 alpha-2 of the present-day country" },
        "historicalAuthority": { "type": "string", "maxLength": 200, "description": "e.g. Russian Empire, Qing dynasty" },
        "authority": { "type": "string", "minLength": 1, "maxLength": 200 },
        "year": { "type": "integer", "minimum": -3000, "maximum": 2026 },
        "scope": { "enum": ["national", "regional", "import", "postal", "library", "school", "religious"] },
        "sourceUrl": { "type": "string", "pattern": "^https://", "maxLength": 500 }
      }
    }
  }
}
