{
  "schemaVersion": "1.0.0",
  "title": "Fixture Book Two",
  "authors": [
    {
      "name": "Basil Fixture",
      "deathYear": 1910
    }
  ],
  "translators": [
    {
      "name": "Clara Fixture",
      "deathYear": 1940
    }
  ],
  "firstPublishedYear": 1895,
  "language": "en",
  "description": "Generated test fixture with a translator and a flagged status.",
  "publicDomain": {
    "sourceName": "Wikisource",
    "sourceUrl": "https://en.wikisource.org/wiki/Fixture"
  },
  "bans": [
    {
      "country": "RU",
      "historicalAuthority": "Russian Empire",
      "authority": "Fixture Censorship Committee",
      "year": 1896,
      "scope": "national",
      "sourceUrl": "https://example.org/alexandria-fixtures/ban-2"
    }
  ],
  "pdf": {
    "cid": "bafkreiey5ec7sp5wbgtmia6wfudct7odctzv7yjjmolsun4i4wupm3kl34",
    "sha256": "0x98e905f93fb609a6c403d62d0629fdc314f35fe12963972a3788e5a8f66d4bdf",
    "bytes": 16190,
    "pages": 12
  },
  "submittedVia": "web",
  "scanReportCid": null
}
